{
  "ajar_version": "0.1",
  "supported_versions": ["0.1"],
  "profiles": ["CORE", "PAY"],
  "site": {
    "name": "Example Knowledge Base",
    "domain": "kb.example",
    "description": "A static documentation and support knowledge base with signed agent views.",
    "languages": ["en"],
    "contact": "agent-access@kb.example"
  },
  "keys": {
    "owner": {
      "kty": "OKP",
      "crv": "Ed25519",
      "x": "ownerKnowledgeBaseKey001",
      "kid": "owner-2026"
    },
    "operational": [
      {
        "key": {
          "kty": "OKP",
          "crv": "Ed25519",
          "x": "opsKnowledgeBaseContentKey001",
          "kid": "content-2026-07"
        },
        "scope": ["content-signing"],
        "valid_until": "2026-10-01T00:00:00Z",
        "certification": {
          "alg": "Ed25519",
          "kid": "owner-2026",
          "sig": "certKnowledgeBaseContent001"
        }
      }
    ]
  },
  "views": {
    "negotiation": ["application/ajar+json", "text/markdown"],
    "index": "/ajar/views/index",
    "chunking": {
      "stable_ids": true,
      "diff": "etag-per-chunk"
    },
    "license": {
      "read": "metered",
      "train": "denied",
      "terms": "/legal/agent-access"
    }
  },
  "policy_summary": {
    "audience_tiers": ["anonymous", "signed", "verified"],
    "rate_limits": {
      "anonymous": "30/h",
      "signed": "600/h",
      "verified": "5000/h"
    },
    "requires_mandate_from_risk": "R2"
  },
  "metering": {
    "currency": "USD",
    "read": {
      "anonymous": "0.0005/req",
      "signed": "0",
      "verified": "0"
    },
    "settlement": ["x402", "offline-invoice"],
    "endpoint_402": true
  },
  "issued_at": "2026-07-02T00:00:00Z",
  "expires_at": "2026-10-01T00:00:00Z",
  "sequence": 3,
  "signature": {
    "alg": "Ed25519",
    "kid": "owner-2026",
    "sig": "manifestKnowledgeBaseSignature001"
  }
}
